{
  "$schema": "https://json-schema.org/draft/2020-12/schema",
  "$id": "https://github.com/newcovid/nonebot-plugin-yijing/data/schemas/special_texts.schema.json",
  "title": "special_texts",
  "description": "Special line texts such as Qian Yongjiu and Kun Yongliu.",
  "type": "array",
  "items": {
    "type": "object",
    "additionalProperties": true,
    "required": [
      "id",
      "hexagram_seq",
      "hexagram_name",
      "label",
      "kind",
      "text",
      "source_id",
      "status"
    ],
    "properties": {
      "id": {
        "type": "string",
        "minLength": 1
      },
      "hexagram_seq": {
        "type": "integer",
        "minimum": 1,
        "maximum": 64
      },
      "hexagram_name": {
        "type": "string"
      },
      "label": {
        "type": "string"
      },
      "kind": {
        "type": "string",
        "enum": [
          "special_line_text"
        ]
      },
      "applies_when": {
        "type": "string"
      },
      "text": {
        "type": "string"
      },
      "source_id": {
        "type": "string",
        "minLength": 1
      },
      "status": {
        "type": "string",
        "enum": [
          "placeholder",
          "draft",
          "seeded",
          "checked",
          "verified"
        ]
      },
      "edition": {
        "type": "string"
      },
      "source_locator": {
        "type": "string"
      },
      "xiang_text": {
        "type": "string"
      },
      "xiang_source_id": {
        "type": "string",
        "minLength": 1
      },
      "xiang_status": {
        "type": "string",
        "enum": [
          "placeholder",
          "draft",
          "seeded",
          "checked",
          "verified"
        ]
      },
      "xiang_edition": {
        "type": "string"
      },
      "xiang_source_locator": {
        "type": "string"
      },
      "notes": {
        "type": "string"
      }
    }
  }
}
